{
  "$schema": "http://json-schema.org/draft-07/schema#",
  "title": "SkillBehavioralTest",
  "description": "Lightweight behavioral test fixture for a skill vertical. Declares the skill under test, a compact scenario brief, the structural signals required in a correct output, and an optional reference example the validator checks offline against those signals.",
  "type": "object",
  "required": ["skill", "brief", "requiredSignals"],
  "additionalProperties": false,
  "properties": {
    "skill": {
      "type": "string",
      "pattern": "^[a-z][a-z0-9]*(-[a-z0-9]+)*$",
      "description": "Kebab-case name of the skill under test. Must match the skill directory name."
    },
    "brief": {
      "type": "string",
      "minLength": 10,
      "description": "Compact scenario that would be handed to the skill."
    },
    "referenceExample": {
      "type": "string",
      "description": "Repository-relative path to an existing artifact the validator checks against requiredSignals. If absent, only fixture structure is validated."
    },
    "requiredSignals": {
      "type": "array",
      "minItems": 1,
      "items": { "$ref": "#/definitions/Signal" }
    }
  },
  "definitions": {
    "Signal": {
      "type": "object",
      "required": ["description", "check"],
      "additionalProperties": false,
      "properties": {
        "description": {
          "type": "string",
          "minLength": 5,
          "description": "Human-readable assertion this signal makes."
        },
        "check": {
          "type": "string",
          "enum": [
            "nodeTypePresent",
            "antiPatternAbsent",
            "rubricCriteria",
            "fieldPresent",
            "fieldMatchesValue",
            "fieldCountAtLeast",
            "allArrayItemsHaveField",
            "fieldValuesInSet",
            "overlayHasDismissal"
          ],
          "description": "Deterministic check type the validator runs against the referenceExample."
        },
        "target": {
          "type": "string",
          "description": "nodeTypePresent: node type name. fieldPresent/fieldCountAtLeast/fieldMatchesValue/allArrayItemsHaveField/fieldValuesInSet: dot-notation path."
        },
        "minCount": {
          "type": "integer",
          "minimum": 1,
          "description": "Required for fieldCountAtLeast. Minimum array length."
        },
        "expectedValue": {
          "description": "Required for fieldMatchesValue. The exact expected value."
        },
        "field": {
          "type": "string",
          "description": "Required for allArrayItemsHaveField and fieldValuesInSet. Field name on each array item."
        },
        "allowedValues": {
          "type": "array",
          "items": { "type": "string" },
          "minItems": 1,
          "description": "Required for fieldValuesInSet. Set of approved string values."
        },
        "value": {
          "type": "string",
          "description": "Legacy single-value field kept for antiPatternAbsent and rubricCriteria signals."
        }
      }
    }
  }
}
