{
  "skill": "storybook-from-component-spec",
  "brief": "Create Storybook scenarios from a ComponentSpec using local UI fixtures, viewport coverage, accessibility checks, and no raw API response fixtures.",
  "referenceExample": ".convention/examples/react-components/product-feature-grid.component-spec.example.json",
  "requiredSignals": [
    {
      "description": "Storybook handoff is required for the component.",
      "check": "fieldMatchesValue",
      "target": "implementationTarget.storybookRequired",
      "expectedValue": true
    },
    {
      "description": "Story fixtures are based on the UI props model.",
      "check": "fieldPresent",
      "target": "propsModel.items"
    },
    {
      "description": "Mobile viewport behavior is covered.",
      "check": "fieldPresent",
      "target": "responsiveBehavior.mobile"
    },
    {
      "description": "Accessibility requirements are carried into Storybook review.",
      "check": "fieldCountAtLeast",
      "target": "accessibilityRequirements",
      "minCount": 1
    },
    {
      "description": "Stories avoid raw API response fixtures.",
      "check": "antiPatternAbsent",
      "value": "raw-api-fixture-data"
    }
  ]
}
