{
  "skill": "generate-page-audit-report",
  "brief": "Audit a dental clinic homepage for accessibility risks, landmark structure gaps, CTA clarity, content hierarchy problems, and proof placement issues. Assign severity for each finding and include evidence and actionable recommendations.",
  "referenceExample": ".convention/examples/page-audit.example.json",
  "requiredSignals": [
    {
      "description": "Audit output is typed as a page audit.",
      "check": "fieldMatchesValue",
      "target": "auditType",
      "expectedValue": "page"
    },
    {
      "description": "Summary of overall audit result is present.",
      "check": "fieldPresent",
      "target": "summary"
    },
    {
      "description": "At least one finding is recorded.",
      "check": "fieldCountAtLeast",
      "target": "findings",
      "minCount": 1
    },
    {
      "description": "Every finding carries a severity rating.",
      "check": "allArrayItemsHaveField",
      "target": "findings",
      "field": "severity"
    },
    {
      "description": "Every finding includes observed evidence for the issue.",
      "check": "allArrayItemsHaveField",
      "target": "findings",
      "field": "evidence"
    },
    {
      "description": "Every finding includes an actionable recommendation.",
      "check": "allArrayItemsHaveField",
      "target": "findings",
      "field": "recommendation"
    },
    {
      "description": "All severity values use approved vocabulary tokens.",
      "check": "fieldValuesInSet",
      "target": "findings",
      "field": "severity",
      "allowedValues": ["info", "low", "medium", "high", "critical"]
    },
    {
      "description": "No severity tokens invented outside the approved vocabulary.",
      "check": "antiPatternAbsent",
      "value": "unknown-severity"
    }
  ]
}
